image_id,caption
100868,a man walks on the sidewalk near taxis and a bus in a busy city street.
100869,"the image features a newspaper article discussing the impact of change, with text highlighting key topics for europe and tunisia."
100870,"a bookshelf filled with various books, including titles on management, career advice, and personal advice."
100871,"a group of people sits at a restaurant table, engaging in an engaging discussion, with tableware on the table."
100872,the image features a large red brick building with a prominent clock tower and a walkway leading to its entrance.
100873,"the image shows a grocery store shelf with jars of cookies and chocolates, labeled for sale."
100874,"an airplane is landing on a grassy runway, surrounded by trees and a hazy sky."
100875,"the image shows a display of various candy bars, including cadbury and cadbury products, in a convenience store."
100876,"a vintage wall clock displays roman numerals on a building facade, labeled "" half - pike jeweller. """
100877,"a green bottle of weihenstephan beer, labeled “ natural gold medal ” and ” shine white. ”"
100878,"two cameramen are positioned on a television studio table, filming videography a person is standing in the background."
100879,"a man in a sports uniform, number 2, watches a baseball game, while a crowd watches intently."
100880,"several boats are docked at a calm marina, surrounded by foggy skies and calm water."
100881,"a illuminated billboard for "" bintao best deals "" features a star logo and colorful text, advertising discounts."
100882,"five cigars are displayed on a dark surface. they feature various labels and designs, emphasizing their vintage and origin."
100883,"a presenter stands holding a pot, with a price tag reading "" £20 "" on a large screen."
100884,"a busy convenience store features various food items, with a man browsing through the aisles."
100885,"a poster displaying craft beer names for various types of beer, featuring types like ipa, stout, and pale ale."
100886,"a close - up view of a mobile phone ' s side, featuring a sleek design and leather cover."
100887,"a woman in a black sweatshirt cooks in a kitchen, with a green bowl on the countertop."
100888,"three men are engaged in a gym setting, demonstrating strength on barsbells, with one man assisting."
100889,"a starbucks coffee cup filled with whipped cream, chocolate pieces, and sprinkles, on a green table."
100890,"a glass of dark beer sits next to a bottle labeled "" trappist, "" with a rich color and foam on top."
100891,"the image shows a vintage typewriter with a keyboard, situated on a small desk beside a typewriter."
100892,"the image features various beer bottles, including ales and craft beers, arranged on a table."
100893,"a vintage cassette tape labeled "" low noise "" with buttons for volume, marked "" greatest bushfit, "" and a small cassette."
100894,"a red stop sign features the word "" berentt "" prominently, displaying the word "" low prices "" and a discount offer."
100895,"two women play football indoors, competing for the ball. one wears a white jersey with blue shorts, the other in black."
100896,"a hand holds a bottle of beer featuring an artistic label with a smiling face, set in a natural outdoor setting."
100897,"a traffic light displays a green signal, indicating vehicles must stop. palm trees and a clear blue sky are in the background."
100898,"a white remote control with various buttons for navigation and settings, featuring a sleek design."
100899,"a black and brown dog is smiling and showing a playful attitude, set within a postage stamp border, showing a tagline and logo."
100900,"a football match in progress with players in jerseys on the field, and a crowd in the stands."
100901,"a smartwatch displays the time as 16 : 28 on a poster, alongside a ruler for measurement."
100902,"a mobile phone displays a map, promoting "" never get lost in the big apple, "" with a google maps app icon."
100903,"a stack of books including titles like "" it ' s complicated cyberville "" and "" community building, "" showcasing various genres."
100904,"the image shows a detailed, silver coin featuring a figure holding a trident, with inscriptions around the edge."
100905,"a black box labeled "" samsung galaxy note ii "" is displayed, partially covering it with a shipping label."
100906,"the image shows a highway with a truck and a car, traffic signals, and trees lining the road."
100907,"a no parking sign stands prominently on rocky terrain, alongside a sign indicating "" france "" and "" c. de couvevres. """
100908,"the image features two glass bottles with caps, alongside a sign discussing a student ' s experience at a university."
100909,"a collection of various coins arranged on a red background, featuring sizes and colors from copper to silver."
100910,"a street view featuring brick buildings, a car parked on the road, and utility poles and grass along the side."
100911,"a collection of vintage books on a shelf, featuring titles and volumes, including "" origin of the species and "" darwin. """
100912,"a young boy in a red sports uniform smiles at a baseball field, showcasing his cheerful expression."
100913,"a white bosch food processor with a glass bowl filled with colorful vegetables and herbs, positioned on a kitchen countertop."
100914,"a glass of amber beer sits next to a can of soda, with an orange and a colorful background."
100915,"a group of athletes in sports uniforms celebrate together, showcasing teamwork and camaraderie in a training facility."
100916,"the image shows a construction site with warning signs indicating "" danger "" and "" hot work "" alerts you progress."
100917,"two military personnel in camouflage converse during a ceremony, with flags and military insignia in the background."
100918,"a variety of whiskey bottles, including japanese and american varieties, are displayed on a bar shelf."
100919,"a decorative wall plaque featuring a blue body with brown tiles, inscribed with "" l ' oeuvres "" and "" la fin des immigres. """
100920,"a blurred poster featuring the title "" eles @ centreponprou "" in bold letters, with vibrant colors and abstract design."
100921,a red stop sign is prominently displayed in front of a street sign for lancster avenue.
100922,"three young women are seated on a bench, wearing sports uniforms. one is speaking to the other. she holds a baseball bat."
100923,"a yellow taxi is parked near a tall lamp post in an urban setting, with buildings and trees in the background."
100924,"a woman in a purple shirt pulls buttons on an lg multi v refrigerator, with a bright logo and packaging design."
100925,"the image features a billboard promoting cross training, with a promotional message about training at cross training academy."
100926,"a boy in a red shirt sits in a bowling chair, reading a game, while a person observes nearby."
100927,"a classic purple book cover featuring intricate gold designs and the title "" the complete book of mormon, "" published by mcdonald."
100928,"the image features a book cover titled "" my distance, "" by emily brown, depicting a woman with a dramatic illustration."
100929,"the image shows a yellow bank bag with various items, including bottles of banknotes and prescriptions, on a textured surface."
100930,"a yellow taxi speeds past a colorful theater entrance in a busy city street, showcasing vibrant signage and crowds."
100931,"the image features a collection of traffic signs indicating various route markers, including south and south west routes."
100932,"a woman with blonde hair wears a floral dress, smiling near a yellow food truck in a busy street."
100933,"the image features several bottles of wine, including a prominent white wine labeled "" clos du gras, "" alongside other wine bottles."
100934,"the image features various electronic devices, including a stylish television, in a magazine layout."
100935,"the image features a keyboard with several stacked tin cans of "" kiwi - slack "" beside it."
100936,"the image features a man wearing a baseball uniform and a cap, posing in front of a sports backdrop."
100937,"a stylish black leather strap watch with a silver case and multiple dials, featuring a classic black design."
100938,"a young boy in a blue baseball shirt and gray pants stands on a field, holding a baseball glove."
100939,"a hockey player skates on the ice, while another player stands nearby, wearing protective gear and a helmet."
100940,"a wooden furniture frame is in progress, showcasing panel support and hardware for assembly, likely a chest of drawers."
100941,"a silver coin featuring a dragon and phoenix, inscribed with "" 1 / 2 "" and "" 5 onzas. """
100942,"a bottle of wine labeled "" hunter select, "" showcasing its vintage and origin from south africa."
100943,"a man in a white shirt and blue tie speaks at a podium in a library, surrounded by books and party banners."
100944,"a person stands near a market stall, wearing jeans, a jacket, and holding a sign that reads, "" lassen satien der schlen. """
100945,"a sleek bottle labeled "" katari 90 "" is showcased in an elegant black box, emphasizing premium olive oil."
100946,"a dark wine bottle with a colorful label featuring the text "" the stupid fish "" prominently displayed."
100947,"a green bottle of beck beer sits on a wooden surface, illuminated by soft light, with a colorful label visible."
100948,"the image features two framed posters : one announces "" twelfth night "" with a historical text, and the other references "" village hall, "" detailing its history and significance."
100949,"a modern building with large windows, featuring multiple tall windows and a green facade, surrounded by bare trees."
100950,"a smiling woman holds two lg mobile phones, showcasing their features and designs in a bright, modern setting."
100951,"the image shows a poster illustrating people in various poses, with signs indicating they ' re engaged in various activities."
100952,"a close - up of a rolex watch face with a black dial, featuring white hour markers, date window, and a winding crown."
100953,"a commemorative coin featuring a profile of thomas jefferson, inscribed with "" in god we trust "" and "" in god we trust. """
100954,"a freight train car features graffiti reading "" seller "" on its side, with a visible fence surrounding it."
100955,"the image shows a blue scarf featuring a british flag design and the text "" rfc "" with decorative elements."
100956,"a bottle of royal willow honey whiskey, featuring a clear amber liquid and a black cap, with a bee illustration."
100957,a boy in a blue shirt is painting at a table with a tablet and a water bottle nearby.
100958,a football match scene shows players in yellow and red uniforms competing for the ball on a grassy field.
100959,"two coffee cups sit on white saucers, accompanied by sugar cubes and a cinnamon stick, ready for enjoyment."
100960,"a blue mercedes sedan parked on grass, surrounded by other vehicles in a scenic outdoor setting."
100961,"two male wrestlers compete on a mat, one in a purple uniform and the other in red, showcasing athleticism."
100962,"the image shows a vehicle registration plate with the letters "" xh 05 "" and the russian flag."
100963,"a man in a black jacket speaks at a conference table, with bottles of water visible in the background."
100964,"book cover for "" midag alley "" by mahfoz, featuring a minimalist design and green text."
100965,"a vintage airplane with a blue and white design is parked on the tarmac, showcasing its classic design."
100966,"the image displays five distinct bottles, featuring a variety of champagnes in varying colors and labels."
100967,"poster promoting an oscar nominations event, featuring a focus on programming, animal behavior, and open source libraries."
100968,"the image shows a scoreboard displaying player information and stats, including player information and stats for the mets and cardinals."
100969,"a lg mobile phone displays a colorful home screen, alongside promotional materials and a stylish design on a stand."
100970,a baseball player in a white uniform prepares to bat while another player stands near home plate. an umpire observes.
100971,"a silver samsung mobile phone with a slide - out keyboard, displaying a digital screen showing time and settings."
100972,"two boxers are sparring in a ring, surrounded by boxing equipment and a referee, with signage above."
100973,"the image features vintage envelopes, some addressed to "" marietta post office, "" and a small stamp, surrounded by handwritten notes."
100974,"the image features a close - up view of a sleek, white aircraft, highlighting its cockpit and cockpit."
100975,"a collection of books on a table, including titles like "" good griefs, "" "" bad griefs, "" and "" acknowledgment, "" and "" winner. """
100976,"a small airplane with a blue and white design is parked on the tarmac, showcasing its national flag and registration number."
100977,"three vintage buses are lined up, featuring a green and cream color scheme, showcasing classic design and signage."
100978,"a digital clock displays the time 11 : 51, with bright red numbers against a dark background."
100979,"a woman and a man are smiling at a table with a fast food item, including a sandwich and a bottle of soda."
100980,"a sign indicating a location with the name "" schloss "" pointing to a cityscape, surrounded by greenery."
100981,"the image features four distinct airships, showcasing designs and names of them all over the world."
100982,"a man is using a laptop, with a computer monitor displaying content nearby and a watch on his wrist."
100983,"a colorful sign featuring a flower design with the text "" nechels and proud "" in bold letters."
100984,"a motivational poster featuring the phrase "" may the mass times acceleration be with you "" in bold yellow and black colors."
100985,"a hooded figure holds a glowing globe, with the text "" fuck you devil - we win the cyber war! "" in bold letters."
100986,"two baseball players walk on the field, wearing gray uniforms with red accents. one holds a glove."
100987,"a historical poster celebrating the centenary anniversary of assembly, featuring bold text and historical phrases."
100988,"two wristwatches are displayed, one with a black dial and one with a dark green fabric strap, showcasing unique designs."
100989,"a book cover titled "" mission flats "" by william landay, featuring a dramatic urban scene with scaffolding."
100990,"a hand with pink nails is resting near a laptop keyboard, with visible typing keys and a partially visible screen."
100991,"a poster illustrating the four steps of wellness, emphasizing the importance of water, health benefits, and wellness in today ' s activities."
100992,a baseball player in a white uniform with the number 12 prepares to pitch on a field.
100993,"a computer monitor displays the xbmc logo on a dark screen, with the name "" noplus prime at home. """
100994,"the image shows a scoreboard at a baseball game, displaying the game score and team details."
100995,"a white ambulance with "" hard life "" markings is parked, featuring a blue and yellow stripe design. its vehicle is not visible."
100996,"a group of men and women in period clothing stands outside a building, promoting the "" real roots bakery. """
100997,"a collection of various coins, including denominations of 2, 5, 10, 20 cents, and 1, 2, 5 euros."
100998,the image features a red and beige book open to a page with text on one side and a blank page on the other.
100999,"a young woman stands with arms crossed outside the john d. kempper hall of engineering, wearing a t - shirt in a city setting."
101000,"four bottles of whiskey are displayed : bacardian, st andrews, and macallan, showcasing rich colors and labels."
101001,"the image shows a coin featuring a building design and the text "" republik osterreich "" and "" 10 euro ""."
101002,"several small brown bottles are displayed, with a cork stopper and a vintage label, suggesting old medicinal products."
101003,"two clear glass jars with a black lid, likely containing milk, are displayed against a light background."
101004,"a man in a red sports uniform stands on a grassy field, wearing striped socks and a cap, with a baseball glove."
101005,"two men in baseball jerseys, labeled "" meyer, "" sit on the seats at a baseball game, with a crowd in the stands."
101006,"a vintage school bus is parked next to a white truck, under a cloudy sky."
101007,"a boy in a sports uniform runs on a track, competing in a race with other athletes."
101008,"a man in a suit holds a book titled "" social empowering europe, "" seated in an indoor setting with a glass of water."
101009,"a smiling woman leans on a stack of bud light cans, with a collection of beer cans visible below."
101010,"two white t - shirts with red text that read "" muskottok v - neck for shirt, "" "" it my deep v - neck for choice, "" and "" super soft blue. """
101011,a football match scene shows players in black and yellow jerseys competing for the ball on a grassy field.
101012,"two white mugs are displayed with the word "" unit "" prominently displayed, resembling a word or text in a foreign language."
101013,a hand holds a mobile phone displaying a colorful lock screen with the time and date visible.
101014,"a clear plastic cup holds a creamy drink, labeled "" i ♥ milk, "" featuring a red heart design."
101015,"a large billboard promoting an event titled "" の 正 "" featuring dance performances, with a focus on tokyo ' s culture."
101016,"the image features a silver coin labeled "" sunshine mini, "" surrounded by colorful stones and a copper book displaying "" u. s. mint. """
101017,"two bottles of pantene pro - v hair product, each 200ml, featuring a deep burgundy color and effective instructions."
101018,"a person ' s feet in bed with a plaid blanket, holding a black remote control."
101019,"a military ship with the designation f359 is navigating through calm waters, alongside a platform for communication."
101020,"a vintage typewriter in a decorative case, featuring a sheet of paper labeled "" nos "" and an instruction manual."
101021,a glass of root beer with a creamy foam sits in front of a gatorade can and a bag of snacks.
101022,"a weathered train car labeled "" nemo "" is parked beside a building with visible graffiti."
101023,"a young man in a yellow sports uniform stands ready on a field, wearing black shorts and footwear."
101024,"three men in sports uniforms pose for a photo, holding a trophy. two women in traditional dresses are present."
101025,"a finnair airplane is taxiing on a wet runway, showcasing its distinctive livery and design features."
101026,"album cover featuring a stylized guitar and a woman, titled "" song and dance man, "" promoting the art of bob dylan."
101027,"a serene beach scene featuring small boats moored in calm waters, with a wooden pier and colorful buildings in the background."
101028,"a baseball player in a purple uniform stands on the pitcher ' s mound, holding a glove, ready for play."
101029,"a crowd of people walks near a structure with a union jack flag, under a cloudy sky."
101030,"the image shows a variety of dishes and drinks, including rice bowls, vegetables, and various drinks, at a restaurant."
101031,"two bottles of alcoholic beverages are displayed : a light green bottle labeled "" pinot noir, "" and a pink bottle labeled "" pinot noir, "" on a wooden table."
101032,"the image features three corded phones, including a corded phone and a digital phone, all with distinct designs."
101033,"a collection of books on a shelf, featuring titles in various languages, including "" la fin des immigres "" and "" la fin des immigres. """
101034,"a man works on a laptop filled with code, while a computer keyboard and monitor are partially visible on the table."
101035,"a white vehicle is parked on a grassy field, with a glider aircraft in the background."
101036,"the whiteboard features sketches and notes on project management, including lists, exports, and collection development strategies."
101037,"a collection of comic books, including "" ms. marvel "" and "" finn "", "" stacked on a wooden surface."
101038,"a dual parking meter stands on a pole, surrounded by grass and a stone wall in the background."
101039,"the image features several books on a table, highlighting "" the triumph of johnny johnson "" with titles of both authors ' names."
101040,"a collection of small bottles filled with a clear liquid, labeled "" diesel warp, "" on a table."
101041,"a dell computer monitor displays the windows 2000 professional logo, showcasing a colorful design with text about installation."
101042,"the image features a man speaking at a podium, with a yellow poster promoting a public meeting in spain."
101043,"a round wall clock with a white face, black hour and minute hands, reading approximately 2 : 10."
101044,"the image shows a convenience store interior with shelves stacked with various products, featuring a prominent "" cash only "" sign."
101045,"two green wine bottles are displayed on a table, labeled "" meursault la tourelles, "" indicating a wine tasting event."
101046,"the image features two red signs on a wall, labeled "" qwerty r1 "" and "" why yes, "" indicating an office workspace."
101047,"a black and silver digital device featuring a prominent button labeled "" parvel, "" likely related to a camera or similar device."
101048,"a boy in a blue sports uniform stands focused, while a girl in black is nearby demonstrating taekwondo techniques."
101049,close - up of an htc mobile phone showing the brand logo and screen with colorful graphics.
101050,"the image shows a scoreboard with baseball scores and player statistics, alongside a score of 7 - 0."
101051,"a chalkboard sign displays a date, time, and a beer festival announcement, dated october 6, 2012, in south west beer fest."
101052,the image shows two calculators on a wooden surface : a white calculator and a large digital calculator.
101053,"a woman in a red sports uniform and cap smiles alongside a mascot in a matching hat, all wearing baseball jerseys."
101054,"a classic red truck is parked, showcasing its vintage design and chrome accents against a clear sky."
101055,"a red traffic sign displaying "" do "" in white letters, positioned at an angle against a clear blue sky."
101056,"a whiteboard with handwritten text stating "" life is no friends allowed, "" emphasizing the connection between us and others."
101057,a plastic cup filled with dark soda sits next to a bottle of buxton soda on a newspaper.
101058,"a digital clock displays the time 8 : 08, a lamp with a decorative base, and books stacked on a table."
101059,"a round wall clock displays black hour and minute hands, showing the time just before 3 : 00."
101060,"a yellow and green train is stationed at a station, with tracks and buildings in the background."
101061,"a green waste container with the text "" the national trust "" and "" wells ice cream "" displayed prominently."
101062,"two colorful tin cans of koala energy drink, featuring cartoonish characters and bold branding, sit side by side."
101063,"a man in a sports uniform runs, wearing a black and yellow uniform with race number 228."
101064,"the image features video game boxes, including "" sc :online "" and "" metroid : the hunger games, "" showcasing vibrant artwork and product details."
101065,a hand holds a bottle of carnouts scotch finger beer next to a glass of beer and a can of beer.
101066,"the image features a collection of neatly arranged glass containers filled with golden coins, alongside a menu."
101067,"the whiteboard displays mathematical equations and functions, written in red ink, discussing concepts related to calculus and functions."
101068,"empty supermarket aisle with shelves stocked with products, featuring a prominent caution sign about parking regulations."
101069,"a man runs along a dirt path, wearing shorts and sports shoes, surrounded by greenery and trees."
101070,"a bookstore named "" alkidi "" features wooden doors, glass shelves, and a welcoming entrance inside."
101071,"a red tablet displays various app icons, including facebook, camera, and camera phone, with a modern interface."
101072,"the image shows two ipads side by side, one in red and the other in white, both featuring the apple logo."
101073,"a military aircraft, specifically a c - 130, is parked on the tarmac with another aircraft nearby."
101074,"three football players in maroon uniforms are on the field, focusing on a player holding a football."
101075,"a large black and white backpack stands on grass near a body of water, with a bicycle helmet nearby."
101076,"a black parking meter stands in a snowy landscape, with a digital display showing time and payment details."
101077,"a hand holds a small glass bottle labeled "" miniter seltzer, "" indicating a small alcohol bottle with a green substance."
101078,"abstract artwork featuring colorful shapes and figures, with a focus on a figure resembling a woman."
101079,the image shows an open book with text on one page and a blurred image of a snake on the other.
101080,"the image shows several bottles of "" honeymoon "" drink, prominently featuring a dark amber liquid and black caps."
101081,"a brown cardboard box labeled "" falling stem "" sits on a surface, with a blue wall and another box nearby."
101082,"a young boy in a mets baseball jersey smiles outdoors, surrounded by people wearing casual clothing and sports hats."
101083,"the image features a promotional sign asking, "" telling friends about money in your pocket, "" highlighting love ' s velo."
101084,"a group of people, including men and women, pose with a piano and an award for music education."
101085,"the image depicts a sign reading "" burning flame, "" indicating a fire station in a rural setting."
