image_id,caption
102825,"the image features three vibrant shoe designs displayed on a glass shelf, showcasing different colors and designs."
102826,"a basketball team poses in matching uniforms, featuring boys in jerseys and a man holding a basketball, celebrating their sports achievement."
102827,"a seiko watch with a black box and case sit atop a box, showcasing a stylish sports watch design."
102828,"a field hockey game is in progress, featuring players in jerseys, a ball, and a goalpost in the background."
102829,"the image features a handmade card depicting a rooster and a bird, labeled "" ecn what? "" in colorful markers."
102830,"a nokia mobile phone displaying a colorful windows interface with various app tiles, including social media and weather."
102831,a football player in a red jersey dribbles the ball while surrounded by other players on the field.
102832,"a vintage typewriter with black keys and a beige body, showcasing classic office supplies from the past."
102833,"a military aircraft with a prominent missile attachment stands on the tarmac, while personnel manage nearby vehicles."
102834,"a rugby match in progress, with players in maroon and blue uniforms, and a referee overseeing the game."
102835,"a red rescue boat named "" u. s. coast guard "" navigates calm waters near a large cargo ship."
102836,"a man holds a camera near a display of colorful toy figures, showcasing various shapes and sizes."
102837,a red stop sign stands at a intersection near a building and street sign for summit street.
102838,"billboard promoting mobile bars with the message "" more bars in more places! "" featuring a contact number and a bright orange background."
102839,"a yellow helicopter with "" jetforce "" markings is parked on a runway, surrounded by greenery and a clear sky."
102840,"the image shows a digital clock displaying the time as 15 : 35, with bright red digits."
102841,"the image shows a display of cold milk bottles, neatly arranged in a cooler. the labeled "" milk "" is visible."
102842,"a "" end "" traffic sign is positioned above a red warning sign, surrounded by dry grass and sparse trees."
102843,"three blue and green waste containers are positioned outside a brick building, with a "" 99 march street "" sign nearby."
102844,"traffic sign stating "" no parking "" and "" time "" for senior citizens, "" with a clear blue sky in the background."
102845,"three women compete in a floorball match, using sticks and a ball on a court."
102846,"the image shows a clothing store with shelves displaying various apparel items, and a prominent "" turnless storage "" sign."
102847,"a helicopter is positioned below a plane, showcasing the united states flag and various circular markings."
102848,"the image features a movie poster for "" the dark knight, "" showcasing a dramatic portrait with dark hair and a red label."
102849,"the image is a promotional poster for "" mybel la melodia "" featuring a young man in an elegant suit, highlighting an event titled "" una shortcuts. """
102850,"a vintage yellow car with chrome accents parked on a street, showcasing classic design and chrome accents."
102851,"a mobile phone displays a playlist titled "" top hip hops, "" while a blurred street scene shows cars and traffic."
102852,"a laptop displays a blue screen with "" your perce - up page and the text "" your perce - up page is not visible. """
102853,"the image shows a bronze coin with the inscription "" united states of america "" and the date "" march 11, "" 1930."
102854,"a street pole displays a warning sign for pedestrians and cyclists, alongside a traffic light and parked cars."
102855,"a red telephone booth with a wi - fi zone sign, featuring multiple contacts and a glass front view."
102856,"a person holds a mobile phone displaying book reviews and article listings, featuring bookmarks for various topics."
102857,"a wooden drawer displays various books, neatly organized and labeled, with visible spines and shelves."
102858,"a dark wine bottle labeled "" nombres del oro "" stands on a table, with a cozy background."
102859,"the image features a display of decorated bottles, likely for garnishes or snacks, with a menu board."
102860,"a woman in a sports uniform stands on a beach volleyball court, preparing to play."
102861,"a woman in a black top and white pants dances with a man in a blue sports uniform, both appearing in a casual setting."
102862,"a vintage magazine cover features a woman leaning over a man, titled "" detective ' s detective, "" with bold colors and dramatic artwork."
102863,"a large, green and beige tent with the brand name "" fufao "" prominently displayed, featuring multiple windows and a side entrance."
102864,"a coffee cup and saucer sit on an orange saucer, with a hand reaching for the cup."
102865,"the image shows a shelf filled with various bags of rice, alongside packaging of matoi and soy sauce products."
102866,a woman in a colorful dress stands beside two modern white refrigerators in a bright kitchen setting.
102867,"the image features a poster advertising "" ghost towns "" route 66, "" with details about ghost towns and attractions."
102868,"a promotional poster for "" dancing with the stars, "" featuring a dynamic figure in a white outfit, surrounded by various characters."
102869,"a bottle of 2010 chablis wine, featuring a simple label and a light brown glass design, showcasing its elegant design."
102870,"two mobile phones display the best phone deals website, featuring various app categories and pricing details."
102871,"the image displays a display featuring multiple photos and text related to the "" built college "" program, showcasing academic events and community involvement."
102872,"a woman holds two lg mobile phones, showcasing their features and screens against a sleek display."
102873,"a taxi is parked near a stone building, while protesters with signs march along the street."
102874,"a young man in a black sports uniform celebrates, while two others, in a gymnasium setting, converse."
102875,"three cheerleaders in matching uniforms perform energetically, smiling and engaging in a lively setting."
102876,"two bottles of miller genuine draft beer are partially buried in snow, showcasing their condensation and cold appearance."
102877,"a round coin displaying "" 1 "" and the inscription "" les tourelles sur - reie "" with a metallic background."
102878,"a cozy cafe interior with people seated, illuminated by colorful lighting and a glass of water."
102879,"the image features a cake designed to resemble a tennis ball, polka dot, and "" tennis "" name, and a cake shaped like a tennis ball."
102880,"a brown bottle of henner ' s beer sits on a table, accompanied by a remote control."
102881,a football match scene featuring players in yellow and black jerseys competing for the ball on a dark field.
102882,"the image displays various colorful watches from different brands, highlighting diverse designs and styles."
102883,"a close - up of a tin can labeled "" piny delder, "" beside a glass of golden beer."
102884,a baseball player in a white uniform with blue accents throws a ball on a grassy field.
102885,"a hand poised over a set of black dice, with a "" supreme court of the united states "" coin positioned nearby."
102886,"the image features several coins arranged in sections, showcasing different denominations and colors, likely from an old book."
102887,"a vintage steam train with a large smoker is parked on the tracks, surrounded by grassy terrain and a distant passenger train."
102888,"a charming storefront of a shop named "" hamersbaar, "" featuring a variety of products and decorative displays."
102889,"a black nokia mobile phone is shown from the back, resting on a wooden surface."
102890,"a man stands in a wrestling ring, celebrating with a championship belt and championship ring in the background."
102891,"a white police van with blue and yellow markings is parked on a street, featuring emergency lights on top."
102892,a basketball player in green attempts a shot while being guarded by a defender in white. spectators are in the background.
102893,"a mobile phone is displayed inside a clear case on a wooden surface, showcasing various app icons on the screen."
102894,"a bottle of vegemite capsule with a yellow cap, labeled "" vegemite "" and containing 15 capsules."
102895,"the image shows a parking sign with instructions for payment of parking items, along with a notice about parking regulations."
102896,"the image features two movie posters titled "" monkey ' s den, "" showcasing dramatic imagery of the characters and the label "" double feature. """
102897,"the image shows several boxes of medication, including one labeled "" 100 "" and two labeled "" 100, "" on a dark surface."
102898,"an open book with blank pages shows handwritten notes on the right side. the page is blank, and the page is blank."
102899,"the image shows a television displaying a timer showing 00 : 21 : 22, with various countdown options visible."
102900,"the image shows a metal tool with a label reading "" cool fog "" and a gear mechanism, alongside other tools."
102901,two mobile phones are displayed side by side on a wooden surface : an iphone and an htc device with a clock.
102902,"three bottles are displayed : a yellow beverage, a bottle of pepsi, and a can of sports soda, all on a glass shelf."
102903,"a muscular man in a sports uniform celebrates, raising his arm, surrounded by people in a crowd."
102904,"a black tin can labeled "" rockstar energy co. "" with a star logo, suggesting it contains a beverage."
102905,"a bright yellow van is parked on grass, showcasing its classic design and cargo style."
102906,"a vibrant mural of a fish with bubbles and a message for "" dixons "" promoting community engagement and sustainability."
102907,"bright neon sign reading "" the beach boy "" with a sun motif and an expiration sticker for "" explorann. """
102908,"a black laptop is resting on a light - colored surface, showcasing a blank screen and a standard keyboard layout."
102909,"a television displays a video featuring a woman with the text "" jour nab instev, "" featuring a song by cri maa."
102910,"a jar of vintage fall ' s flavored fruit juice, labeled "" monster jam, "" featuring a vintage image and checkered label."
102911,a woman in a black dress and flats smiles while posing with a phone near a yellow taxi.
102912,"a bottle of stoffer ' s caramel lager next to a glass filled with golden beer and frothy head, resting on a wooden table."
102913,"a close - up of a white samsung mobile phone, showcasing its back panel and camera."
102914,"a decorative wall clock featuring a winged figure holding a staff, labeled "" angel of the sea. """
102915,"the image features a bottle of cointreau, labeled as "" four cuatro, "" indicating it ' s a specialty whiskey."
102916,"a yellow and white aircraft is flying in the air, displaying the number 748rr."
102917,"a colorful poster for "" star wars, "" featuring characters with lightsabers, stormtrooper, and character in a space scene."
102918,"an airbus a380 airplane climbs into the sky, showcasing its large wingspan and dual - engine design."
102919,a row of green coca - cola bottles displaying the brand logo and label details.
102920,"a yellow train engine stands beside a green freight train, with mountains in the background and trees in view."
102921,"a bottle of wine labeled "" domaine des latours lanes, "" featuring a green and yellow cap, against a wooden background."
102922,"a speaker stands at a podium, speaking at an event with two computer monitors displaying a cityscape background."
102923,"the image shows the entrance of a travel store called "" flight centre, "" featuring magazines and an informational display."
102924,a small airplane is parked next to large cargo containers at a shipping yard.
102925,"an open book page featuring text that discusses the universe, with the heading "" ancient press "" prominently displayed."
102926,"a sailboat with white sails navigates the calm water, surrounded by flags. the sky is clear and blue."
102927,"a poster welcoming attendees to "" bridgeport water school "" in burnes, maine, features names of participants and educational resources."
102928,"a white mug features an animated character with a square face, accompanied by the phrase "" coci des pass une ripe. """
102929,"a brown bottle of jacklach beer, labeled "" strong out, "" featuring a label with a yellow - themed character."
102930,"the image features two vintage clocks : one with a blue rim and the other with a white face, both displaying different times."
102931,"a boy in a sports uniform stands in front of a soccer field, with a sign welcoming visitors."
102932,"four distinct bottles of various beer brands are displayed, featuring brands like stone, urban lager, and black ipa."
102933,"a boy in a blue baseball jersey runs towards home plate, while another boy in a black catcher ' s gear looks on."
102934,"a bustling urban street at dusk, featuring bright signage, pedestrians, and colorful advertisements in various languages, showcasing a mix of streetwear and shops."
102935,a curved road with a traffic sign indicating a 25 km / h speed limit in goa. greenery along the side.
102936,"a person in a colorful skirt and jacket poses confidently, wearing knee - high socks and a necklace, with a backdrop of mountains."
102937,"a collection of colorful aircraft sits on the ground, with various designs and sizes, alongside racing equipment and accessories."
102938,"a red train, labeled "" trafic, "" is positioned near a railway platform with tracks and greenery."
102939,"a round wall clock displays black numbers and hands, showing the time as approximately 2 : 10."
102940,"two yellow waste containers are positioned next to each other, one labeled "" mirane, "" and the other "" general waste. """
102941,"a player in a white sports uniform with maroon accents stands in a baseball position, ready to bat."
102942,"the image shows a whiteboard with diagrams and notes on design or technology, focusing on concepts like "" design concepts "" and "" design concepts. """
102943,"the image features a framed notice regarding a service station management agreement, detailing maintenance procedures and responsibilities."
102944,"a busy urban scene featuring a tall building with advertisements, cars, and pedestrians on a busy street."
102945,"a framed painting of a woman holding a child, surrounded by greenery and a golden background."
102946,"a young man sits at a desk with a laptop and a monitor, surrounded by office supplies and a notebook."
102947,"the image shows a computer monitor displaying health articles on dietten koffen, including statistics on weight and body fat percentage."
102948,"the image features the book "" echo round his bones "" with a vibrant cover design, showcasing abstract science fiction imagery."
102949,"a tray of raw meat is displayed alongside a metal pot, with some pieces of meat visible on the countertop."
102950,modern building with a large glass entrance and stairs leading up to the entrance area.
102951,a group of players in blue sports uniforms gathers on the baseball field for a team photo.
102952,a young man in a red and black sports uniform prepares to throw a soccer ball on a grassy field.
102953,"a white van is parked on a paved street, with a street light and surrounding greenery."
102954,"a woman with long hair smiles, promoting the "" 3 national awards "" website with awards details and notable nominations."
102955,"a framed photo features a basketball player wearing a chicago bulls uniform, showcasing sports equipment and a vibrant team logo."
102956,"a public payphone with a payphone stand, featuring a coin slot and an advertisement board."
102957,"a display of various items, including clothing and accessories, with a sign indicating price at a market."
102958,"a sleek blue perfume bottle with a silver cap rests on a teal box labeled "" fragrance. """
102959,"the image features a billboard displaying "" lifted by entrasiators, "" surrounded by boxes on a street scene."
102960,"the image shows a beverage section at soft drinks station, featuring refrigerated displays and various drink options."
102961,"a person holds several shiny gold coins with intricate designs, held in a hand."
102962,"a yellow diamond - shaped traffic sign reads "" bump, "" featuring a playful nose design and the word "" no eyes. """
102963,"a person holds a casio watch displaying time and temperature, with a scenic background showing trees and water."
102964,"two crew members in red jackets stand near a military ship, with the ocean and sky in the background."
102965,"a pharmacy promotional banner features a smiling woman in a lab coat, standing beside medication boxes."
102966,"the image shows a book titled "" underground traffic society, "" featuring a minimalist design and a red cover."
102967,"two buses are parked in a row, with buildings in the background and urban transportation activity visible."
102968,"a person with short hair is reading a book titled "" the july century, "" surrounded by a circular design."
102969,"a wooden table displays various stationery items, including pens, markers, and a decorative paper lantern."
102970,"three dark glass bottles of garnieric vodka are displayed on a wooden surface, featuring cork stoppers and a prominent logo."
102971,"the image features a colorful mural on a wall, with various waste containers below, including red containers below."
102972,"a decorative book titled "" el jardino en la mancha "" by yasmina khadra, displayed with intricate purple designs on the cover."
102973,"a large vending machine stands beside a smaller chair, both featuring colorful branding and buttons for various beverages."
102974,"a comic book cover featuring the silver surfer with a dynamic design, showcasing silver surfer and his human foe."
102975,"the image features a large clock overhead, showcasing olympic and olympic symbols in a vibrant urban setting."
102976,"two men in baseball uniforms smile together, one wearing sunglasses and the other with a logo, both wearing team logos."
102977,"a clear bottle of old farm rooi sits on a rooftop, with a view of buildings and cloudy skies."
102978,"a military helicopter is parked on grass, surrounded by trees, with a clear blue sky in the background."
102979,"the image features a volkswagen vehicle with a red and blue border, displaying the registration plate "" 027 "" and the brand name "" grandeur. """
102980,"the image displays a car ' s digital dashboard, showing radio and connectivity with various apps and a temperature of 32 degrees."
102981,"a white glass - door display cabinet features two sections : one shelf displays a tree silhouette, the other labeled "" ef green. """
102982,"a bottle of la rosee la bourgon wine, vintage 2013, with a dark glass and a red cap, displayed against a wooden background."
102983,"the image shows an open book page featuring educational content about the uses of the lg logo, with section options visible."
102984,"a jar of light creamy dessert, labeled "" creamy, "" with a simple design, resting on a wooden surface."
102985,"a green tin can of kopparch ' s kozel beer, featuring a dog design and labeled with 5 % alcohol."
102986,"a busy street scene features a modern building with a glass roof, surrounded by other structures and vehicles."
102987,a large white whipped cream in a black container sits next to a large white mug.
102988,"the image shows a box of nestle chocolate macaroni and cheese snack, labeled as "" cheese macaroni and cheese. """
102989,"the image depicts a convenience store shelf filled with various packaged goods, including snacks and beverages."
102990,"an assortment of coins displayed on a wooden surface, including pennies, nickels, dimes, and quarters."
102991,"a group of men in golf attire celebrate, holding a trophy, showcasing teamwork and victory in golf."
102992,"a convenience store interior featuring a geya store sign, various products, and customers browsing around."
102993,"the image features vintage advertisements for fireworks, a brand name for fireworks, and a little demon labeled "" sparks. """
102994,"the image shows an open book page with text discussing a historical event, including a message about the duke ' s visit to ireland."
102995,"a road curves ahead, featuring a vehicle on the road and a traffic sign warning of restricted access."
102996,"the image displays a stack of spacya tea bags, featuring various flavors and brands, arranged for display."
102997,"a large yellow sign reads "" mart mart, "" featuring the name "" mart mart "" above a grocery store interior."
102998,"a man in a boat is surrounded by trees and foliage, preparing to navigate the water."
102999,"the image features a vibrant mural of a smiling character with a playful expression, resembling a poster or promotional message."
103000,"a vintage philips television displays the message : "" what ' s your favorite show? "" in bold white letters on a black screen."
103001,"a brown cardboard box with tape measures rests on a wooden floor, showcasing a measure and label."
103002,"a silver audi sedan parked on the street, featuring a visible registration plate : b - 7770on."
103003,"a large submarine named "" william g. matter "" is docked, featuring a prominent submarine logo and a clear blue sky backdrop."
103004,"the image features a modern building with a unique glass facade, alongside a modern skyscraper."
103005,"a player swings a baseball bat, while a catcher prepares to catch the pitch, with spectators in the background."
103006,"a scenic view of a river with mountains in the background, accompanied by a quote from psalms 11 : 9."
103007,"a close - up of a coin shows its detailed edge and surface, highlighting the denomination ' s name and denomination ' s edge."
103008,"a convenience store displays various drink options, including coca - cola and energy drinks, with colorful signs and outdoor displays."
103009,"a vintage advertisement for gardner & semour ' s "" the best flour, "" featuring a woman and various food items."
103010,"a large billboard displays train routes for walt disney and disneyland, promoting walt disney ' s railroad to disneyland."
103011,"a man in a sleeveless black sports uniform, featuring a crab design, poses confidently with a focused expression."
103012,"a vintage wall clock with a floral design, featuring roman numerals and decorative elements on a wooden background."
103013,"red world map poster promoting "" your url is blocking "" with a message from @ t. l. c.."
103014,"the image depicts a vintage book cover titled "" les mennonettes d ' un raut, "" featuring intricate illustrations and a decorative background."
103015,"a close - up of a computer keyboard with a printed document beneath it, showcasing branding and specifications."
103016,"a whiteboard displays a quote by steve bay about creativity and customer service, emphasizing the importance of storytelling."
103017,"two soldiers in military uniforms stand together, holding flags and medals, with one wearing a military hat and gown."
103018,"a vintage wall clock with a red background features black hour and minute hands, indicating the time clearly."
103019,"a hand holds the book "" eberhard bossett "" by chris lane, featuring a industrial - themed cover design."
103020,"the image features a vinyl record cover titled "" djh story remix, "" showcasing two male dancers with vibrant colors and artistic designs."
103021,"a large airplane is parked at a terminal, with ground support equipment nearby and a cloudy sky in the background."
103022,"the image features a colorful poster for "" magia berreso apiria, "" highlighting a top music event in melika, with a ticket purchase details included."
103023,"a sleek white computer keyboard sits beside a gray computer mouse, showcasing modern design and functionality."
103024,"a hand holds a clear bottle labeled "" koya, "" with a silver bracelet and bracelet, against a plain background."
103025,"a blue and yellow train engine is displayed indoors, showcasing its distinctive design and visible wheels."
103026,"a bottle of 2010 les loups wine, labeled "" la fin des loups, "" features a simple design with text and a gold foil cap."
103027,"a white van marked with "" debuut "" drives on a city street, featuring a clear logo and license plate."
103028,"a collection of anime posters featuring various characters and titles, displayed on a wooden surface."
103029,"a page from a book displaying vocabulary words and numbers, including terms like "" vocabulary "" and "" number ""."
103030,"directional traffic sign indicating directions to pure michigan and "" sadie ' s april 5th, "" along with an arrow pointing right."
103031,"a white bus with blue and yellow stripes is parked at a bus stop, ready for passengers."
103032,"a person is holding a wooden structure in a gym, with a quote from james 3 : 9 displayed above."
103033,"a vintage airplane, identified as the zeiss, is flying against a cloudy sky."
103034,the image shows a close - up of a computer keyboard with visible keys and a small component near the keys.
103035,"a baseball player in a gray cincinnati uniform, number 32, stands on the field, showcasing the team ' s logo and name prominently."
103036,"three female wrestlers compete on a mat, wearing sports uniforms and footwear, with a referee overseeing the action."
103037,"a grand monument featuring classical columns, inscribed with "" on this day, "" and "" august 12, "" surrounded by green trees."
103038,"a racetrack field featuring red and yellow racing cars, with banners and spectators in the background."
103039,"the image features a vintage book cover titled "" de jure natura et gentium "" by londruf sansovino, published in paris in 1678."
