image_id,caption
101739,"a decorative box featuring the "" forbidden planet "" logo, containing dark liquid and a glowing design, sits on a wooden surface."
101740,"two mobile phones are displayed side by side, showing the time and date as 3 : 11 on their screens."
101741,a circular wall clock with a brass frame and a white face and various time indicators is mounted on a wall.
101742,"two computer keyboards are displayed in an open box, featuring a black keyboard with white keys and a beige box behind them."
101743,"a man in a washington nationals sports uniform holds a baseball glove, preparing for play during a game."
101744,"a charming storefront features green doors, a sign reading "" esplanza, "" with a person walking by."
101745,three bottles of corona beer and a bottle of corona light beer are displayed on a refrigerator shelf.
101746,"the image features three colorful tin cans : a green organic beer, a yellow soda, and a red coca - cola beverage."
101747,"a blue and white mug with a "" dyncia castle "" label, featuring a playful text message."
101748,digital clock displaying 6 : 12 : 20 for the timex finish line at new york city marathon 2010.
101749,"the image shows a sony playstation 3 console and controller, with the gamepad and screen visible in the box."
101750,a man in a beige shirt measures the width of a wooden shop sign inside a workshop.
101751,"four men stand on a basketball court, wearing colorful sports uniforms. one wears a red jersey, the others in blue."
101752,"a person writes on a whiteboard, illustrating a complex problem involving cad drawings and line graphs."
101753,"a white and red bus is parked on a street, displaying a route to london ' s victoria hall."
101754,a hand holds a mobile phone displaying a colorful lock screen with a time of 15 : 52 and a weather forecast.
101755,"the image features several bottles of cordial, showcasing their rich chocolate flavored drink in a promotional setting."
101756,a framed model displays an electrosthetic structure with labeled sections and a control panel below.
101757,the image shows a vintage computer keyboard with various function keys on a patterned surface.
101758,"a television displays a news broadcast with an explosion, featuring headlines and a scenic view of a city."
101759,"four men stand together, wearing baseball uniforms labeled "" miami angels, "" posing casually in front of a stone building."
101760,"two men wearing baseball jerseys, one holding a trophy, cheer enthusiastically in a lively crowd."
101761,"a group of people stands by a whiteboard, discussing a discussion related to a presentation or outline."
101762,"a vibrant volleyball match is happening indoors, with players in action and a large crowd cheering in the background."
101763,"a woman in a white hoodie stands over a man in a gray jacket, holding a phone, outdoors."
101764,"a television displays the show "" i got a boy "" on a table filled with various books, alongside a large bookcase filled with various titles."
101765,"a television displays a video of a singer performing, alongside the phrase “ has gracias! ” in bold letters."
101766,"a poster features humorous text stating, "" i like cooking my family and my pets, "" emphasizing the theme "" don ' t be a psycho. """
101767,"a military aircraft on a carrier deck, with personnel observing and discussing nearby against a cloudy sky."
101768,"the image shows a box of whole grain cheerios, featuring a bright yellow design, labeled as "" send a cheerios message. """
101769,"a spacious office space features a wooden panelled wall, a presentation area with white displays, and a long table with chairs."
101770,"a bottle of 2004 lager beer is displayed on a wooden surface, showcasing its label and amber liquid."
101771,"a white nokia mobile phone with a simple keypad and a blank screen, positioned from the front."
101772,"two vehicles are parked in a large, open space with a concrete structure and industrial elements."
101773,"a hand holds a watch and a fishing reel, with water splashing in the background on a boat."
101774,"four female runners compete in a race, wearing sports uniforms with "" wikies "" and "" 5 memos, "" alongside a television."
101775,"the image features a promotional poster for "" daniels lake city, "" showcasing a boat on a serene water scene with text about adventure."
101776,"a smiling woman with a black sports uniform and a red logo, sitting against a wooden background."
101777,"a truck drives on a highway toward a exit sign for "" knecht, "" with a clear blue sky in the background."
101778,"the image features a vintage book page with latin text, detailing its title and author, published in 1583."
101779,"a silver hp pavilion 15 laptop is open, displaying the logo on the screen and showcasing a sleek design."
101780,"the image shows a coin featuring a portrait of a man, dated 2009."
101781,"a glass beaker containing dark liquid, with a straw inserted, likely containing a liquid or mixture."
101782,"a blue and red pepsi can sits on a table, accompanied by a note reading, "" i ' m in love! ""."
101783,"a person holds two mobile phones, displaying various travel documents and a smartphone with a passport."
101784,"a vintage alarm clock with a white face shows black numbers and hands, placed on a stack of books."
101785,"the image is a colorful poster featuring various figures, with text in german promoting a cultural event on may 1st."
101786,"the image shows the title page of a book titled "" commentaries on the laws of england, "" published in 1861."
101787,"a display of various books, neatly arranged on tables, showcasing titles and genres."
101788,"the image shows a book cover titled "" 20 years of rolling stone, "" highlighting a long, strange trip it ' s been."
101789,"a modern bosch microwave oven with a metallic finish, featuring a digital display and control panel."
101790,"a young boy in a black baseball uniform, wearing a glove, crouches on a field, ready to play."
101791,"a television screen displays a person ' s image, showing a neutral expression while seated in a venue."
101792,"two boats are anchored in calm waters, surrounded by lush greenery and a sandy beach in the background."
101793,"a stylish silver and gold watch with a white dial, featuring chronograph functions and a brown leather strap."
101794,"a street scene featuring two yellow taxis, a taxi with smoke, and a shopping building with advertisements."
101795,"four boys play football indoors, wearing matching white and orange jerseys, with one boy kicking a ball."
101796,"a man in a blue mets jersey stands on a baseball field, holding a baseball glove and looking focused."
101797,"two mobile phones are displayed : an lg smartphone on the left and an lg smartphone on the right, both featuring textured back panels."
101798,"the image shows a large fishbowl tank made of lego, featuring a television screen and water features."
101799,"a brown leather - bound book titled "" matthew 544, "" accompanied by a biblical verse promoting the study."
101800,"a smiling man in glasses holds a bottle of epic roa, a rich black soda."
101801,"the image shows a page from a book titled "" plasting "" featuring instructions for plasting on a canvas, with illustrations and descriptive text."
101802,"the image features a promotional poster for a call of duty eternal warfare, highlighting gameplay and promotional information."
101803,"a collection of vintage magazines and comic books, featuring colorful covers and various artwork styles."
101804,"a baseball player stands on the field, focusing on the game, with a scoreboard and advertisements in the background."
101805,"a large ferry named "" shipbuilder "" with a red and white tower, docked near a building complex."
101806,"vintage poster for "" swingin ' with marieie "" featuring performers in costumes, highlighting a play titled "" southern charm. """
101807,"the image shows a colorful display of toy story products, with characters resembling characters, set against a bright background."
101808,"a modern library interior featuring colorful shelves, a bookcase, and a welcoming atmosphere with ribbon barriers."
101809,"a collection of colorful billiard balls arranged on a blue table, featuring various numbers and colors, ready for play."
101810,"the image features a california vehicle registration plate reading "" adsense, "" with a bmw emblem above it."
101811,"the image shows a virginia vehicle registration plate with the text "" sonuva "" and a colorful design."
101812,"a bottle of mike lee texas ranger barrel aged beer, featuring a rustic design and labeled "" texas ranger barrel aged. """
101813,"a white boat with flags floats in calm waters, surrounded by greenery and a rocky shore."
101814,"the image features a presentation poster with sections on human anatomy and physiology, promoting human anatomy with text in japanese."
101815,"modern glass elevator with a modern design, featuring a handrail and stairs, leading to an indoor space."
101816,"an lg monitor is displayed, showing a blue screen with an error message. the monitor is closed."
101817,"the image shows a poster on a gray surface, featuring the title "" citizen dick "" and a photo of two people."
101818,"a compact calculator sits on top of a document titled "" jit - d707 multi - function calculator, "" alongside a remote control."
101819,"the image shows an open book page with a quote by oscar wilde about dedication, loss, and deception."
101820,"a billboard displays the text "" good to be back home "" against a colorful background, emphasizing a casual and inviting atmosphere."
101821,"the image features a magazine cover titled "" brain damage, "" showcasing vibrant artwork and text about music ' s impact."
101822,"a wooden table displays various drinks, including juice and salad dressing, alongside empty bottles in the background."
101823,"a close - up of a stylish silver and blue watch with a white dial, featuring chronograph functions and a detailed date window."
101824,"the image shows an old typewriter keyboard, featuring keys arranged in the azerty layout, a classic office supply."
101825,"a child in pajamas sits near a decorated christmas tree, opening gifts under the tree in a bright room."
101826,"a vibrant, bold poster featuring the word "" rys "" in bold, pink letters, with abstract, stylized elements."
101827,"vintage hermes typewriter, showcasing black keys and a classic design, showcasing classic office supplies."
101828,"a stylish watch with a black face and silver bracelet, worn on a wrist with a necklace."
101829,"the image features two images : one with a bible, and the other a cover of a book, titled "" o amor. """
101830,"two players in action on a court, one dribbling the ball while the other defends. floorball is visible."
101831,"the image features a vibrant poster with the text "" love, techno, "" "" great escape, "" and "" johnny webbman. """
101832,"a silver coin featuring a detailed maple leaf design, inscribed with "" canada "" and the year "" 2009. """
101833,"a young woman in a pink sports uniform stands near a volleyball net, looking thoughtfully into the distance."
101834,"a poster detailing the construction of a birou crop research facility, detailing specifications and performance metrics for agricultural research."
101835,the image shows a vehicle registration plate with the numbers 509 xun and a slogan about marathoning marathons.
101836,"a whiteboard timetable for a t - shirt break, featuring notes on training, schedules, and challenges related to t - shirts."
101837,"a man in a gray baseball uniform prepares to pitch, wearing a red cap and baseball glove on his left hand."
101838,"two stylish wristwatches are displayed : one with a black dial and silver design, and another with a silver bracelet."
101839,"a team of athletes in blue and yellow sports uniforms poses with a mascot in a stormtrooper, set against a stone backdrop."
101840,"scoreboard at virginia stadium shows a basketball game : cal strength center, with 2 : 13 remaining in the second period. fans are visible in the background."
101841,"the image shows a grey vehicle with a visible registration plate "" tkd "" is parked beside a grassy area."
101842,"a baseball game scene featuring players in uniforms on the pitcher ' s mound, with spectators in the background."
101843,"the image displays a collection of science fiction and horror movie posters, featuring various titles and authors."
101844,a player in a sports uniform swings a baseball bat while a catcher prepares to receive the pitch during a game.
101845,"a book titled "" scott pilgrim "" is displayed, featuring a bright orange cover with white text."
101846,"a floorball game in progress features players in red and black jerseys, using sticks and a ball on a wooden court."
101847,"the image features various decorative items : a photo frame, a ceramic pitcher, and a coffee pot, all set for a festive display."
101848,"a woman with blonde hair holds a certificate of excellence from the root of module competition, smiling in a bookstore setting."
101849,"the image features a book cover titled "" sea siege "" by andre norton, depicting a man sitting in front of a vibrant, illustrated background."
101850,"a close - up of a wine bottle label, featuring "" reference "" from skalli family, with a green glass and simple design."
101851,"the image features a silver watch with a leather strap, showcasing a vintage design and a detailed leather strap."
101852,"a crowded stadium filled with fans, supporting teams at a football match, showcasing team spirit and support."
101853,a sony ericsson mobile phone displays a list of mobile phones with various offers and options for download.
101854,"the image features a bus with an artistic design, including a double - decker design and a side view."
101855,two men in baseball uniforms converse on the field. one wears a blue jersey and the other a light blue jersey.
101856,"a row of yellow taxis is parked along a busy street, showcasing various taxi designs and colors."
101857,"a blue billboard reads "" the hotel california, "" with a distance of 16. 70, set against a clear sky."
101858,a man in a suit is speaking to a silhouetted figure in front of a computer monitor displaying usernames.
101859,"a large group of birds flies beneath a clear blue sky, showcasing a diverse group of birds."
101860,"a plate featuring a battered fish, fried fries, and a can of coke cola, alongside drinks."
101861,"the image features several colorful cans of sake, labeled with various types, including sake and white wine."
101862,"a poster for a concert titled "" we almaat lost in china, "" featuring a silhouette of a singer with bold text."
101863,"the image shows a coffee machine and grinder set up on a countertop, with a menu board displaying various coffee products."
101864,"the image shows a refrigerator shelf filled with various food items, spices, sauces, and drinks."
101865,"the image shows a vibrant urban mural and art gallery with colorful designs, under a glass roof."
101866,"a hand holds a htc mobile phone displaying a text message and the time, with a green screen indicator."
101867,"a tin can of diet coke sits on a wooden desk, with a computer keyboard and mouse visible in the background."
101868,"the image shows a store interior with glass shelves displaying various items, including bottles and equipment, in a vintage style."
101869,"a yellow blender with a transparent container, featuring measurement markings and a control knob at the base."
101870,"a football match scene with players and referees on the field, surrounded by a cheering crowd in red and white."
101871,"a hand holds a box of fruit juice labeled "" vitamin c, "" with a grocery store background visible in the background."
101872,"a smiling man in a green shirt and black trousers sits on a red table, surrounded by audio equipment."
101873,"a shelf displays various books, including titles on radio and music, with colorful spines arranged neatly."
101874,"modern skyscrapers dominate the background, featuring a large building with a glass facade and surrounded by greenery."
101875,"a red traffic sign with a white stripe indicates "" no u. s. street "" under a blue sky, indicating a pedestrian crossing."
101876,"the image shows a grand building, likely a train station, surrounded by greenery and cars parked nearby."
101877,"a glass of amber beer beside a bottle of innis & gunn beer, showcasing a rich color and foam."
101878,"a person holds a compact camera with a digital display, capturing a scene in a vehicle ' s dashboard."
101879,"the image features a vintage advertisement for "" alma polish, "" showcasing a polishing product in a decorative box."
101880,"a baseball pitcher in a gray phillies uniform prepares to throw, while a crowd watches attentively."
101881,"a baseball player in a white uniform with the number 22 pitches on a field, with spectators in the background."
101882,"a convenience store shelf displays various bottles of mouthwash and mouthwash products, neatly arranged in rows."
101883,"a red no tractor sign is displayed near a street sign for "" livvasons, "" indicating no tractor ahead."
101884,"a green notebook page lists notes on settings, including a phone number, and a personal note about work."
101885,"the image shows a computer monitor displaying a starbucks payment interface, featuring options for transaction details and payment details."
101886,"the image features a book cover titled "" christian ' s consumer guide : 99 cents "" by robert christianau, highlighting consumer choice."
101887,"the image shows a collection of colorful papers, including advertisements, a television, and scattered graphic designs."
101888,"the scoreboard displays "" get loose "" with a countdown timer and the game ' s time, remaining time, at the united center."
101889,"a baseball game in progress, featuring players in uniforms on the field, a crowd in the background, and enthusiastic fans."
101890,"two women are shaking hands at a table with materials, surrounded by other attendees. one woman is dressed, while the other is in a black jacket."
101891,"the image shows a book cover titled "" cover - up at ann arbor, "" by harry haines, featuring an abstract design with a sun symbol."
101892,"a spacious convenience store interior featuring shelves of products and a prominent "" school day "" sign at the top."
101893,"a large airplane, identified as air france, is landing on a snowy runway, creating a spray of water."
101894,"a hand reaches for a bottle inside a stainless steel refrigerator, with shelves and drinks visible in the fridge."
101895,"a person holds a sony playstation vita handheld gaming console, displaying a vibrant screen with game options."
101896,"the image shows a page from a historical book, featuring ornate text in a cream - colored background and a red emblem."
101897,"the image shows a computer monitor displaying a promotional website for a free android phone app, featuring a circular button."
101898,"the image features a vintage advertisement for palm beach lumber, depicting a man in winter attire carrying lumber."
101899,"a person holds a casio watch with a black face, silver band, and a date display."
101900,"a brown cardboard box with a label reading "" nutella "" and an orange sticker, resting on a light surface."
101901,"a close - up of a luxury dive watch with a black dial, blue bezel, and date display."
101902,"four people are engaged in a collaborative workspace, using laptops and engaging in discussion over drinks."
101903,"a person sits in the front of a green train, with a scenic track and trees in the background."
101904,"the image features a vintage computer monitor displaying multiple screens and knobs, resembling early computing or encoding machines."
101905,"a smiling man in a white shirt and red corduroy apron stands indoors, showcasing a casual and professional vibe."
101906,"a classic green double - decker bus parked on grass, with a red bus in the background."
101907,"a close - up of a computer keyboard with a blue cable inserted, showcasing a network cable connector."
101908,"a blender filled with liquid sits on a countertop, alongside bottles of soplica and other beverages."
101909,"a baseball player in a white uniform prepares to pitch, while a coach in black observes nearby, surrounded by a crowd."
101910,"the image features several colorful brochures with cartoon designs, including a hello kitty and a balloon."
101911,"a military aircraft performs a maneuver, emitting smoke trails against a clear sky, showcasing its sleek design."
101912,a black iphone 3g is displayed next to a black box and a colorful sticker indicating it ' s a iphone 4.
101913,"the image features several wine bottles, each labeled with the word "" san gil "" and the number "" h. o. c. """
101914,"a hand holds a bottle of country lane cream liqueur, with a glass partially filled with the drink beside it."
101915,"a green glass bottle of heineken beer sits on a wooden table, with a blurred background."
101916,"a bustling urban scene at night, featuring vibrant billboards, cars, and a yellow taxi in the foreground."
101917,"the image features a colorful billboard advertising "" a caribbean mojito "" with vibrant artwork and branding from nan goh. vodka."
101918,"a large billboard displays "" forty niners "" alongside the gateway arch, advertising an event at the united states."
101919,"a red train is positioned on the tracks, surrounded by greenery and mountains in the background."
101920,"a man in a baseball uniform throws a pitch on the field, with another player in the background."
101921,"a dell laptop displays a digital interface with control options and a logo for "" radio tinubis. """
101922,"three men are seated on a stage, discussing design concepts, with unique furniture designed from cardboard boxes."
101923,"a brightly lit gas station at night, with vehicles parked and people boarding at gates."
101924,"a white ambulance with blue stripes features silhouettes of individuals and text indicating "" pet squad, "" "" families, "" and "" army. """
101925,"a lacrosse game features players in yellow and gray jerseys, with a goalie in the background and another player ready to block."
101926,"a person walks past a yellow diamond traffic sign indicating a walking ahead, set against a wooded road."
101927,"a woman wears a white t - shirt with a red border and a graphic waistband, smiling while walking in a crowd."
101928,"four basketball players in purple uniforms are playing basketball in a gymnasium with a scoreboard displaying "" welcome to the wildcats ""."
101929,"a man in a white tennis outfit prepares to hit a ball, while a crowd watches from the stands."
101930,a closed laptop displays a textured screen with a black keyboard and a simple logo on the front.
101931,"a glass of beer with a light brown color, filled with bubbles, sits on a wooden table."
101932,a group of young baseball players in blue uniforms with white numbers huddle together on the field.
101933,"a tin can of new wave soda, labeled "" original flavor, "" with a silver design and red accents."
101934,"a man wearing a white shirt and a cap displays a number, while two children in red shirts stand nearby."
101935,"a bottle of red wine labeled "" chateau la fleurie, "" resting on a wooden surface."
101936,"the image shows a vehicle registration plate from new south wales, featuring the number "" 8 "" and the year "" august 1988. """
101937,"a vintage poster for the "" exhibition "" featuring a graphic design, promoting an exhibition on color, with the tagline "" lithography in the center. """
101938,"a man with a beard stands in front of a banner, presenting at an event."
101939,"a white mug features a red background with bold text : "" shih! i ' m having a maii moment! "" it holds a small book."
101940,a group of football players in red jerseys celebrates a goal on the field during a match.
101941,"a black - and - white image of a bookcase filled with various books, including titles on programming and technical programming."
101942,"a coffeemaker is positioned next to two dispensers, a can of soda, and various cups on a wooden table."
101943,"a table is covered with condiments, a plastic bottle, and a bag of water. the setting is a party setting."
101944,"a laptop displays a webpage, surrounded by various books, plants, and office supplies on a table."
101945,"a baseball player in a mets uniform shakes hands with an umpire on the field, showcasing a sports celebration."
101946,"a sleek black coffee maker sits next to a white coffee cup, with a shiny metal finish and branding."
101947,"a humorous figure of a gnome sits atop a waste container filled with crumpled tissue, accompanied by a playful text."
101948,"the image features a billboard for macy ' s furniture clearance, displaying a red star logo and a white sign with a blue sky backdrop."
101949,"a silver dell computer monitor displays a blue screen, complemented by a black keyboard on a desk."
101950,"two red double - decker buses are parked, labeled "" kentham "" and "" devon, "" showcasing classic design."
101951,"a metallic circular object with a hole, possibly an artifact, shown with a ruler for scale."
101952,"a white box labeled "" clleansu "" containing an item with a specific location, placed on a wooden surface."
101953,"the image shows a football field with empty seating, a few vehicles, and a large scoreboard in the background."
101954,"a display featuring several books, including titles on geography, culture, and biodiversity, arranged on a table."
101955,"a bright orange banner with white text that reads "" i am busy "" along the bottom."
101956,"a laundry room scene featuring a washing machine, plastic bag with items, and a few boxes."
